{
  "schema_version": "1.0.0",
  "receipt_id": "SIGMA-512-CONTINUOUS-LOCAL-EXECUTOR-PROBE-001-HP-cb0569c182a7",
  "request_id": "SIGMA-512-CONTINUOUS-LOCAL-EXECUTOR-PROBE-001",
  "status": "SUCCESS",
  "recorded_at": "2026-08-17T01:11:38.439363+00:00",
  "canonical_repository": "SIGMA-UNIVERSE-NATURE/sigma-freedom",
  "canonical_branch": "SIGMA_LIFE",
  "resolved_head_sha": "cb0569c182a7dc35183d5a6341c76bfe6fabf7ae",
  "executor": {
    "runtime_name": "SIGMA Remote Operator Continuous",
    "runtime_version": "0.6.0",
    "platform": "Windows-10-10.0.19045-SP0",
    "python": "3.14.4",
    "private_workspace_disclosure": "PRIVATE_NOT_RECORDED_PUBLICLY"
  },
  "result": {
    "harness_id": "SIGMA-512-CONTINUOUS-LOCAL-EXECUTOR-PROBE-001",
    "harness_version": "1.0.0",
    "result_sha256": "2fe5fcc6f54e2dc915dbcb2ff81df476a794b5d7a6831fdfa6cb189488f22042",
    "counts": {
      "TARGET_COUNT": 8,
      "PASS": 0,
      "PARTIAL": 8,
      "HOLD": 0,
      "FAIL": 0,
      "NOT_AUDITED": 0
    },
    "result_location_disclosure": "PRIVATE_LOCAL_REFERENCE_OR_REDACTED"
  },
  "integrity": {
    "core_tree_before_sha256": "f51df6895c975b157d8fc02c1ddfe2ff11847203b3da332a25e6e234eddb95be",
    "core_tree_after_sha256": "f51df6895c975b157d8fc02c1ddfe2ff11847203b3da332a25e6e234eddb95be",
    "core_modifications": 0,
    "external_side_effects": 0
  },
  "safety": {
    "paid_api_used": false,
    "secrets_disclosed": false,
    "external_network_side_effects": 0
  },
  "blockers": [],
  "notes": [
    "HARNESS_RETURN_CODE=0",
    "AUTO_DISCOVERED_FROM_CANONICAL_REQUEST=true",
    "REMOTE_COMMAND_FILE_USED=false",
    "CANONICAL_REQUEST_ID_NOT_HARDCODED=true",
    "LEGACY_SELF_STUDY_AND_K_CYCLE_NOT_EXECUTED",
    "ARBITRARY_SHELL_USED=false",
    "MATERIALIZED_SOURCE_TREE_UNCHANGED=true",
    "MATERIALIZED_SOURCE_SHA256_BEFORE=84fc37fe097ce518c51c13704eb5bc60d84f153e16d32593f487763061df6131",
    "MATERIALIZED_SOURCE_SHA256_AFTER=84fc37fe097ce518c51c13704eb5bc60d84f153e16d32593f487763061df6131",
    "PRIVATE_LOCAL_PATHS_REDACTED_FROM_RECEIPT",
    "CANONICAL_EVALUATOR_MUST_DECIDE_ANY_PROMOTION_OR_NEXT_ACTION"
  ]
}
