{
  "schema_version": "1.0.0",
  "receipt_id": "SIGMA-512-AUTO-MEASURE-SECTION-XXIII-326-350-HP-af77fdeb04b2",
  "request_id": "SIGMA-512-AUTO-MEASURE-SECTION-XXIII-326-350",
  "status": "SUCCESS",
  "recorded_at": "2026-08-17T22:29:15.718144+00:00",
  "canonical_repository": "SIGMA-UNIVERSE-NATURE/sigma-freedom",
  "canonical_branch": "SIGMA_LIFE",
  "resolved_head_sha": "af77fdeb04b273a8d482f030c32a13c00922b5fc",
  "executor": {
    "runtime_name": "SIGMA Remote Operator Continuous",
    "runtime_version": "0.6.1",
    "platform": "Windows-10-10.0.19045-SP0",
    "python": "3.14.4",
    "private_workspace_disclosure": "PRIVATE_NOT_RECORDED_PUBLICLY"
  },
  "result": {
    "harness_id": "SIGMA-512-AUTOMEASURE",
    "harness_version": "1.0.0",
    "result_sha256": "ec9deed57c57a5dc1f187d147ef9c524f5b4ffb615f308ffc5ba09a654c5fbc6",
    "counts": {
      "TARGET_COUNT": 25,
      "PASS": 0,
      "PARTIAL": 0,
      "HOLD": 25,
      "FAIL": 0,
      "NOT_AUDITED": 0
    },
    "result_location_disclosure": "PRIVATE_LOCAL_REFERENCE_OR_REDACTED"
  },
  "integrity": {
    "core_tree_before_sha256": "f51df6895c975b157d8fc02c1ddfe2ff11847203b3da332a25e6e234eddb95be",
    "core_tree_after_sha256": "f51df6895c975b157d8fc02c1ddfe2ff11847203b3da332a25e6e234eddb95be",
    "core_modifications": 0,
    "external_side_effects": 0
  },
  "safety": {
    "paid_api_used": false,
    "secrets_disclosed": false,
    "external_network_side_effects": 0
  },
  "blockers": [],
  "notes": [
    "HARNESS_RETURN_CODE=0",
    "AUTO_DISCOVERED_FROM_CANONICAL_REQUEST=true",
    "REMOTE_COMMAND_FILE_USED=false",
    "CANONICAL_REQUEST_ID_NOT_HARDCODED=true",
    "LEGACY_SELF_STUDY_AND_K_CYCLE_NOT_EXECUTED",
    "ARBITRARY_SHELL_USED=false",
    "MATERIALIZED_SOURCE_TREE_UNCHANGED=true",
    "MATERIALIZED_SOURCE_SHA256_BEFORE=7f2d6d0d676ceb3b1b6aa8ad91003a2c5f03f32e41bf8e5fc7179d7dbfac267d",
    "MATERIALIZED_SOURCE_SHA256_AFTER=7f2d6d0d676ceb3b1b6aa8ad91003a2c5f03f32e41bf8e5fc7179d7dbfac267d",
    "PRIVATE_LOCAL_PATHS_REDACTED_FROM_RECEIPT",
    "CANONICAL_EVALUATOR_MUST_DECIDE_ANY_PROMOTION_OR_NEXT_ACTION"
  ]
}
